,Name,Brand,Rating,BestSeller,AmazonChoice,Comments,Price,Stars
585,"Stevenson Entertainment Group Talking 12"" Donald J. Trump The Apprentice Collectible",Visit the Hot Wheels Store,"4,693 ratings",0,0,0,$7.80,4.5 out of 5
586,Factory Entertainment The Beatles: with The Beatles Famous Covers Collectable Die-Cast Bus,Brand: POP,288 ratings,0,0,0,$11.19,4.5 out of 5
587,"Surreal Entertainment Demon Slayer Oversized Plush Throw Blanket | Cozy Sherpa Cover For Sofa, Bed | Super Soft Fleece Blanket | Official Anime Manga Collectible | 45 x 60 Inches, Blue, One Size",Visit the Great Eastern Entertainment Store,202 ratings,0,0,0,$21.29,4.7 out of 5
588,SUPER MARIO Plush Mario Collectible Toy,Visit the Funko Store,"1,452 ratings",0,0,0,$13.81,4.4 out of 5
589,Surreal Entertainment Exclusive Saturday Night LiveinchMore Cowbellinch Ceramic Coffee Mug Official Comedy TV Show Collectible Novelty Drinkware For Home Kitchen Set Holds 11 Ounces,Visit the Sunny Days Entertainment Store,"9,924 ratings",0,0,0,$14.99,4.4 out of 5
590,"Marvel Titan Hero Series Action Figure Multipack, 6 Action Figures, 12-Inch Toys, Inspired Comics, for Kids Ages 4 and Up (Amazon Exclusive)",Visit the LEGO Store,"1,105 ratings",0,1,46 answered questions,0,
591,Antiques and Collectibles,Visit the Great Eastern Entertainment Store,"8,047 ratings",0,0,0,$13.66,4.7 out of 5
592,"LEGO Star Wars: The Mandalorian Imperial Light Cruiser 75315 Awesome Toy Building Kit for Kids, Featuring 5 Minifigures; New 2021 (1,336 Pieces)",Visit the Great Eastern Entertainment Store,"1,880 ratings",0,0,0,$16.34,4.9 out of 5
593,"Factory Entertainment Halloween 2 Tin Tote Various, 6""",Brand: Entertainment Earth Inc,1 rating,0,0,0,$7.95,3 out of 5
594,Throw Pillow Case The Office Merch Dwight Schrute Cushion Home Living Room Soft Square Pillowcase Cover for Decor Bedroom Couch 18 X 18 Inch,Visit the STAR WARS Store,5 ratings,0,0,13 answered questions,$154.69,4.7 out of 5
595,"ZHBWOW Liquid Motion Bubbler for Kids Adults,Sensory Toys,(3-Pack) Fidget Timer Liquid Toy,Autism Toy,Oil Water Desk Toy,Anxiety Toys，Christmas Stocking Filler Gift",Brand: Entertainment Earth,71 ratings,0,0,3 answered questions,$39.99,4.7 out of 5
596,"CelebriDucks Wicked Witch - Premium Bath Toy Collectible - Fantasy Movie Themed - Perfect Present for Collectors, Celebrity Fans, Music, and Movie Enthusiasts",Brand: Rainling,"1,632 ratings",0,0,26 answered questions,$28.99,4.7 out of 5
597,"Kismet Decals Armored Batman Attack Officially Licensed Wall Sticker - Easy DIY Justice League Home, Kids or Adult Bedroom, Office, Living Room Decor Wall Art Decal Mural Small",Visit the Nifeliz Store,57 ratings,0,0,0,$119.95,4.6 out of 5
598,"Kismet Decals Batman #609 Comic Cover Series Officially Licensed Wall Sticker - Easy DIY DC Comics Batman Home, Kids or Adult Bedroom, Office, Living Room Decor Wall Art Decal Mural Small",Brand: Kunzbs,58 ratings,0,0,0,0,
599,LEGO Star Wars at-ST Raider 75254 Building Kit (540 Pieces),Visit the Nifeliz Store,732 ratings,0,0,3 answered questions,$89.95,3.7 out of 5
600,"NVIDIA SHIELD Android TV Pro Streaming Media Player; 4K HDR movies, live sports, Dolby Vision-Atmos, AI-enhanced upscaling, GeForce NOW cloud gaming, Google Assistant Built-In, Works with Alexa",Visit the Wikki Stix Store,592 ratings,0,0,17 answered questions,$5.77,4.4 out of 5
601,Wooden Jigsaw Puzzles 1000 Pieces for Adult Rainbow Castle Scenery Landscape Jigsaw Puzzles Entertainment DIY Toys Collectibles Creative Birthday Gift for Kids Teens Family Home Decor,0,3 ratings,0,0,0,0,5 out of 5
602,Blizzard Entertainment Diablo 3 III Mini Tyrael Statue from Blizzcon 2011 and Sideshow Collectibles,Visit the LEGO Store,"15,355 ratings",0,0,30 answered questions,0,4.9 out of 5
603,Spider-Man 2099 #22,Visit the Mattel Games Store,2 ratings,0,1,80 answered questions,$10.99,
604,Alloy Collectible Lamborghini Toy Vehicle Pull Back Die-Cast Car Model with Lights and Sound,0,45 ratings,0,0,0,0,0
605,"Surreal Entertainment Godzilla Chibi King Ghidorah Ceramic Mug Exclusive | Official Kaiju Collectible, Monster Zero Coffee Cup | Drinkware For Home Barware Set | Holds 11 Ounces, White",Visit the Funko Store,79 ratings,0,0,0,$18.00,0
606,Factory Entertainment The Beatles: Beatles for Sale Famous Covers Collectable Die-Cast Taxi,Visit the CVCBSER Store,"1,947 ratings",0,0,68 answered questions,$84.99,
607,"Funko Pop Marvel Games: Spider-Man Video Game - Unmasked Spider-Man Collectible Figure, Multicolor, Standard",Visit the Hot Wheels Store,35 ratings,0,0,0,$9.99,4.5 out of 5
608,"Overwatch Collectible Art Metal License Plate by Blizzard Entertainment. Best Buy Pre-Order Exclusive Collector's Item. Widowmaker, Symmetra, Tracer, Reinhardt, Hanzo, Genji, Mercy, Mei, and More",Visit the POP Store,3 ratings,0,0,0,$22.55,4.8 out of 5
609,TRANSFORMERS #55 ALL HAIL OPTIMUS ROM VARIANT,Visit the Mount-It! Store,461 ratings,0,0,34 answered questions,$94.99,4.4 out of 5
610,"Monopoly: The Lord of The Rings Edition Board Game Inspired by The Movie Trilogy, Family Games,, Ages 8 and Up (Amazon Exclusive)",0,198 ratings,0,0,0,0,4.5 out of 5
611,"Mini SAI White GT3 Racing Car MOC Building Blocks and Construction Toy, Adult Collectible Model Cars Set to Build, 1:14 Scale Sports Car Model (1268 Pcs)",Brand: Topps,169 ratings,0,0,0,0,0
612,"Ascension Tactics 100ct Deck Protector Sleeve - Protect Your Battle Cards from Wear and Tear During Gameplay Against Friends and Enemies, Cards Sleeves Gaming Cards and Collectible Cards",Brand: Topps,"2,822 ratings",0,0,0,0,0
613,Factory Entertainment Jaws Jumbo Bruce The Shark Collectible Plush,Visit the LEGO Store,32 ratings,0,0,15 answered questions,$79.75,4.9 out of 5
614,"Cryptozoic Entertainment Gal Gadot as Wonder Woman Vinyl Figure, 7""",Visit the LEGO Store,"17,556 ratings",0,0,5 answered questions,$51.42,4.8 out of 5
615,Off Topic Adult Party Game - Fun Board and Card Game for Group Game Night,0,14 ratings,0,0,0,0,4.6 out of 5
616,Factory Entertainment The Big Lebowski Fandages Collectible Fashion Bandages,Brand: Entertainment Earth,"1,266 ratings",0,0,0,0,5 out of 5
617,"Factory Entertainment Animal House Tin Tote, 6"" (408291)",Visit the Cryptozoic Entertainment Store,147 ratings,0,0,0,$7.99,4.8 out of 5
618,Spider-Man Imposter Pop! Vinyl Figure 2-Pack – Entertainment Earth Exclusive,Brand: Autograph Warehouse,"1,756 ratings",0,0,0,$4.00,0
619,Factory Entertainment Garfield Shakems Collectible Figure,Visit the Kicko Store,2 ratings,0,0,0,$17.19,4.5 out of 5
620,"Cryptozoic Entertainment Vinyl Terrorz: Freddy Krueger Vinyl Figure - 7"" Figure Comes Packaged Inside Display Box",Visit the Sunny Days Entertainment Store,28 ratings,0,0,0,$7.49,
621,STAR WARS DOCTOR APHRA 19,Visit the Great Eastern Entertainment Store,43 ratings,0,0,0,$13.99,5 out of 5
622,LEGO Super Mario Reznor Knockdown Expansion Set 71390 Building Kit; Collectible Toy Playset for Kids; New 2021 (862 Pieces),Brand: Monopoly,2 ratings,0,0,99 answered questions,0,4.8 out of 5
623,Thunder Roller Truck Hot Wheels 2015 Retro Entertainment Series BJ & The Bear 1:64 Scale Collectible Die Cast Metal Toy Car Model,Visit the LEGO Store,168 ratings,0,1,0,0,4.8 out of 5
624,"Nifeliz Badboy Steam Train Building Kit, Collectible Steam Locomotive Display Set, Large Train Set with Train Tracks, Top Present for Train Lovers (1608 PCS)",Visit the Nifeliz Store,301 ratings,0,0,0,$119.95,
625,"Nifeliz Super car 819 MOC Building Blocks and Construction Toy, Adult Collectible Model Cars Set to Build, 1:14 Scale Sports Car Model (1049Pcs)",Visit the Nifeliz Store,64 ratings,0,0,9 answered questions,$149.95,4.1 out of 5
626,"1:32 Scale Model 3 Alloy Car Model Diecast Toy Vehicles for Kids, Pull Back Collectible Vehicle Toy Door Opening with Lights and Music, Birthday Gift for Boys Girls Children",Visit the Cingfung Store,"1,756 ratings",0,0,14 answered questions,$19.99,3.6 out of 5
627,"La Granja de Zenon Adventure Action Figures Set in Tin Box, 20 Collectible Action Figures, Toys for Kids",Visit the Nifeliz Store,7 ratings,0,0,6 answered questions,$54.95,4.7 out of 5
628,"Alliance Entertainment 6.5"" Predator Stylized Collectible Figure",Visit the Sharper Image Store,2 ratings,0,0,0,$25.99,
629,"Entertainment Earth Marvel Select Spider-Gwen Action Figure, Brown",Visit the Nifeliz Store,7 ratings,0,0,0,$109.95,3.6 out of 5
630,Factory Entertainment Archer Sterling Shakems Premium Motion Statue (Talking),Brand: GiantBee,"1,864 ratings",0,1,0,$26.99,4.9 out of 5
631,"Factory Entertainment DC Comics Superman Action Comic #1, Premium Motion Statue",Visit the Nifeliz Store,"8,241 ratings",0,0,0,$59.95,4.1 out of 5
632,"Factory Entertainment Universal Monsters Fandages Collectible Fashion Bandages, Orange",Visit the Nifeliz Store,297 ratings,0,0,0,$119.95,
633,Greys Anatomy You're My Person Ceramic Coffee Cup | Collectible Friendship Celebration Mug | Holds 16 Ounces,Brand: MGA Entertainment,5 ratings,0,0,0,$28.15,0
634,Animal Puzzle 1000 Pieces- Black and White Zebra - Puzzle for Adult Entertainment DIY Toys Collectibles Creative Birthday Gift for Kids Decompression Toy,0,56 ratings,0,0,0,$54.95,4.6 out of 5
635,The NES Encyclopedia: Every Game Released for the Nintendo Entertainment System,Brand: Toynk,4 ratings,0,0,0,$29.99,4.4 out of 5
636,Factory Entertainment REVOS DC Comics Self-Righting Collectible Shazaam Figure,Brand: POP,405 ratings,0,0,0,$12.99,4.9 out of 5
637,Great Eastern Entertainment JoJo's Bizarre Adventure S3 SD Josuke PVC Keychain,0,"10,155 ratings",0,0,0,$19.99,0
638,Sunny Days Entertainment M1114 Up-Armored Humvee – Vehicle Playset with Action Figure and Realistic Accessories | 9 Piece Military Toy Set for Kids – Elite Force,0,1 rating,0,0,0,0,0
639,The Batman (Blu-ray),Visit the Great Eastern Entertainment Store,"7,172 ratings",0,0,0,$17.34,4.7 out of 5
640,"PCS Collectibles Transformers: Grimlock PVC Statue, Multicolor",Visit the LEGO Store,4 ratings,0,0,16 answered questions,$63.99,4.9 out of 5
641,Blizzard Entertainment Legends Diablo Crusader Statue,Brand: Factory Entertainment,7 ratings,0,0,0,0,5 out of 5
642,Elite Force Marine Recon Action Figures – 5 Pack Military Toy Soldiers Playset | Realistic Gear and Accessories – Sunny Days Entertainment,Brand: Marvel,17 ratings,0,0,18 answered questions,$49.97,4.7 out of 5
643,Cuphead Bobbling Figurine: With sound! (RP Minis),Visit the LEGO Store,169 ratings,0,0,0,$58.94,4.9 out of 5
644,"5 Surprise Unicorn Squad Series 2 Mystery Collectible Capsule by ZURU (2 Pack PVC Tube), Purple",Visit the LEGO Store,17 ratings,0,0,124 answered questions,0,
645,Birds of Prey Harley Quinn and Beaver Pop! Vinyl Figure with Collectible Card - Entertainment Earth Exclusive - and with 1 Compatible PET Graphic Protector Box,Brand: Keefer,"49,626 ratings",0,0,0,$28.97,2.8 out of 5
646,Factory Entertainment Garfield Statue Figure (Gallery Edition),Visit the Bgraamiens Store,"1,746 ratings",0,1,5 answered questions,$18.99,4.6 out of 5
647,Factory Entertainment The Beatles Yellow Submarine Slippers,Brand: POP,50 ratings,0,0,0,$89.88,4.9 out of 5
648,Pick Your Poison Card Game: The “What Would You Rather Do?” Game - After Dark Edition,Visit the Great Eastern Entertainment Store,"1,373 ratings",0,0,0,$21.22,4.4 out of 5
649,DC Collectibles Batman: Arkham City: Series 3 Azrael Action Figure,Visit the Meta Quest Store,59 ratings,0,1,0,0,
650,Factory Entertainment Forbidden Planet Tin Tote,Brand: Factory Entertainment,18 ratings,0,0,0,$242.29,4.7 out of 5
651,The Mint Condition: NFT and Digital Collectibles Entertainment,Visit the Hot Wheels Store,"1,244 ratings",0,0,0,$97.77,0
652,Disney Lotso Scented Bear - Toy Story - 12 Inches,0,1 rating,0,0,0,0,0
653,DC Collectibles DC Designer Series: Batman by Rafael Grampá Statue,Visit the REAL LITTLES Store,"14,152 ratings",0,1,4 answered questions,$17.75,4.7 out of 5
654,"Mini SAI GTR Super Racing Car MOC Building Blocks and Construction Toy, Adult Collectible Model Cars Set to Build, 1:14 Scale Sports Car Model (1024 Pcs)",Visit the Great Eastern Entertainment Store,"1,401 ratings",0,0,0,$21.57,3.9 out of 5
655,"CelebriDucks Dorothy Wizard of Oz - Premium Bath Toy Collectible - Fantasy Movie Themed - Perfect Present for Collectors, Celebrity Fans, Music, and Movie Enthusiasts",Brand: Factory Entertainment,"1,541 ratings",0,0,0,$115.12,5 out of 5
656,Bgraamiens Puzzle-Roof Cityscape-1000 Pieces Old City View Art Puzzle Color Challenge Jigsaw Puzzles for Adults and Kids,Visit the Alderac Entertainment Group (AEG) Store,3 ratings,0,0,0,$19.83,4.3 out of 5
657,TERABITHIA 18inch 47cm So Truly Soft Wool Puppy Silicone Vinyl Full Body Reborn Baby Boy Girl Dolls Washable Preemie Pinky Look Newborn Doll Twins,Visit the 5 Surprise Store,"2,548 ratings",0,1,77 answered questions,$12.99,
658,Bgraamiens Puzzle-Puppies’ Party-1000 Pieces Cute Cartoon Dogs Puzzle Color Challenge Jigsaw Puzzles for Adults and Kids,Visit the LEGO Store,"70,217 ratings",0,0,27 answered questions,0,4.8 out of 5
659,Enesco Facets Disney Tinker Bell Acrylic Facet Collection Figurine,0,"1,780 ratings",0,0,0,0,4.6 out of 5
660,The Mint Condition: NFT and Digital Collectibles Entertainment,Visit the Nifeliz Store,3 ratings,0,0,0,$54.95,4.5 out of 5
661,Marvel Hasbro Design and 13 Accessories Legends Series X-Men 6-inch Collectible Deadpool and Negasonic Teenage Warhead Action Figure Toys,Brand: Iron Studios,227 ratings,0,0,0,$199.99,0
662,Factory Entertainment Masters of The Universe Teela's Staff of Ka Scaled Prop Replica Gold,Visit the Nifeliz Store,"1,454 ratings",0,0,0,$49.95,4.6 out of 5
663,NEW 2016! DC Comics: DC Bombshells Mini Vinyl Figures Blind Mystery Tin - New Collectible 2016,Brand: POP,84 ratings,0,0,0,$69.88,4.7 out of 5
664,"Factory Entertainment Star Trek Ressikan Flute Limited Edition Prop Replica, Multicolor, Standard",Visit the LEGO Store,82 ratings,0,0,8 answered questions,0,4.9 out of 5
665,Marvel Classic Black Light Collectible Poster Portfolio,Visit the LEGO Store,"14,152 ratings",0,1,7 answered questions,0,4.9 out of 5
666,"HOMEOART Home Theater Cinema Canvas Wall Art Prints Classic Vintage Movie Film Painting Family Entertainment Media Room Decor Stretched Framed Artwork 12""x12""x4 Panels",Brand: MGA Entertainment,"1,401 ratings",0,0,0,0,4.2 out of 5
667,Factory Entertainment The Beatles Yellow Submarine Slippers,Brand: Factory Entertainment,3 ratings,0,0,0,$14.00,4.6 out of 5
668,"ArtCreativity Mini Horse Figurines Set for Kids - Pack of 12 - Assorted 2.5 Inch Small Horses, Sturdy Plastic Toys, Fun Birthday Party Favors, Great Playset for Boys and Girls Ages 3+",Visit the Cryptozoic Entertainment Store,990 ratings,0,0,4 answered questions,$17.99,4.5 out of 5
669,Pink Batman Pop 75th Anniversary Pink Rainbow Batman Vinyl Figure Entertainment Earth Exclusive,Brand: MGA Entertainment,130 ratings,0,0,0,$9.99,4.5 out of 5
670,"Funko POP! Games: Destiny Amanda Holliday Collectible Figure, Multicolor",Visit the LEGO Store,2 ratings,0,0,33 answered questions,0,4.9 out of 5
671,Funko POP Marvel: Nemesis Punisher Action Figure,0,538 ratings,0,0,0,$11.21,4.1 out of 5
672,"Deadly Foes (Marvel OverPower Card Game, 55 Collectable Playing Cards)",Visit the POP Store,5 ratings,0,0,0,$12.49,4.9 out of 5
673,"Skillmatics Educational Game: Boredom Buster | Reusable Activity Mats with Dry Erase Marker | Gifts, Travel Toy & Learning Tool for Ages 3-6",0,34 ratings,0,0,0,0,4.6 out of 5
674,Hasbro Collectibles - Transformers Rescan 3 Pack,Visit the Surreal Entertainment Store,"7,934 ratings",0,0,0,$35.99,4.7 out of 5
675,Disney Pin - Christmas Holiday 2021 - Lady and the Tramp,Brand: Factory Entertainment,11 ratings,0,0,0,0,4.2 out of 5
676,Marvel Comics Mini-Books Collectible Boxed Set: A History and Facsimiles of Marvel’s Smallest Comic Books,Brand: Factory Entertainment,"1,541 ratings",0,0,0,$24.35,5 out of 5
677,Alter Nation El Ray Human Stingray Electric EEL Hybrid Web Cartoon Dark Horse Comics Graphic Novel Action Figure with “Lightning Storm” Light up Feature & Mini Comic Book Great Gift for Kids 6 & Up,Visit the Great Eastern Entertainment Store,12 ratings,0,0,0,$18.78,4.7 out of 5
678,Cryptex Da Vinci Code Mini Cryptex Lock Puzzle Boxes with Hidden Compartments Anniversary Valentine's Day Romantic Birthday Gifts for Her Gifts for Girlfriend Box for Men,Brand: Factory Entertainment,5 ratings,0,0,0,$13.18,5 out of 5
679,Mario Party Superstars - Nintendo Switch,Brand: Stevenson Entertainment Group,"1,746 ratings",0,0,22 answered questions,0,4.7 out of 5
680,"LEGO Marvel Spider-Man: Spider-Man's Monster Truck vs. Mysterio 76174; Cool, Collectible Birthday Gift for Kids, New 2021 (439 Pieces)",Brand: Factory Entertainment,520 ratings,0,0,0,0,5 out of 5
681,"Big Fish (Special Edition, with Collectible Book)",Brand: Surreal Entertainment,"1,116 ratings",0,0,0,$37.99,4.4 out of 5
682,LEGO Creator Expert James Bond Aston Martin DB5 10262 Building Kit (1295 Pieces),Brand: SUPER MARIO,56 ratings,0,0,0,$7.99,4.6 out of 5
683,Factory Entertainment The Beatles Drum Head Bottle Opener,Brand: Surreal Entertainment,76 ratings,0,0,0,$12.99,5 out of 5
684,"Nifeliz CN5700 Steam Train Building Kit and Engineering Toy, Collectible Steam Locomotive Display Set, 1：38 Scale Model Train Building Kit with Train Tracks, Top Present for Train Lovers (1136 PCS)",Visit the Marvel Store,31 ratings,0,1,7 answered questions,$53.48,4.7 out of 5
685,Ingooood- Jigsaw Puzzle 1000 Pieces for Adult- Fantasy Series- Exhibition Bookstore_IG-1217 Entertainment Wooden Puzzles Toys…,0,"1,094 ratings",0,0,0,0,0
686,"Kismet Decals Detective Comics #1000 VAR Comic Cover Series Officially Licensed Wall Sticker - Easy DIY DC Comics Batman Home, Kids or Adult Bedroom, Office, Living Room Decor Wall Art Decal Small",Visit the LEGO Store,3 ratings,0,0,7 answered questions,0,4.9 out of 5
687,Dundie Award Trophy – The Office Merchandise – Dunder Mifflin Memorabilia Inspired by The Office,Brand: Factory Entertainment,20 ratings,0,0,0,$24.95,4.6 out of 5
688,"Disney Pixar Cars Movie Die-cast Character Vehicles, Miniature, Collectible Racecar Automobile Toys Based on Cars Movies, for Kids Age 3 and Older",Brand: Zbenfm,12 ratings,0,0,0,$11.98,
689,101 Conversational Questions: 1st Edition,Brand: ZHBWOW,1 rating,0,0,0,$15.15,4.4 out of 5
690,"DIAMOND SELECT TOYS Marvel Gallery: Avengers Infinity War Movie Thor PVC Diorama Figure, Standard, Black",Visit the CelebriDucks Store,121 ratings,0,0,11 answered questions,$19.99,
691,"Enesco Trail of Painted Ponies “Storm Rider” Stone Resin Horse Figurine, 7”",Visit the Kismet Decals Store,"3,039 ratings",0,0,0,$14.93,
692,"Great Eastern Entertainment Dragon Ball Super - Frieza Plush 02 7""",Visit the Kismet Decals Store,2 ratings,0,0,0,$14.93,
693,"LEGO Ideas Ship in a Bottle 92177 Expert Building Kit, Snap Together Model Ship, Collectible Display Set and Toy for Adults (962 Pieces),Multicolor",Visit the LEGO Store,1 rating,1,0,18 answered questions,$38.48,
694,Modiphius Entertainment Mindjammer Companion,Visit the NVIDIA Store,10 ratings,0,1,981 answered questions,$199.99,4.6 out of 5
695,Funko Pop! One of a Kind Groot Wood Deco! – Marvel Guardians of The Galaxy - Vinyl Figure - Bundle - Funko Vinyl Collectible Protector Box,Brand: STACYPIK,23 ratings,0,0,0,$24.99,
696,Antiques and Collectibles,Brand: Blizzard Entertainment,8 ratings,0,0,3 answered questions,0,3.7 out of 5
697,Enesco Facets Disney Winnie The Pooh Figurine ND6009038,0,7 ratings,0,0,0,0,0
698,This is Fine Dog Pop! Vinyl Figure - Entertainment Earth Exclusive,Brand: iLooboo,5 ratings,0,0,4 answered questions,$23.99,4.6 out of 5
699,Factory Entertainment Outlander Lithographic Print Set,Brand: Surreal Entertainment,159 ratings,0,0,0,$14.99,
700,Mickey Mouse Frankenstein Mickey Cosplay Mini-Backpack - Entertainment Earth Exclusive,Brand: Factory Entertainment,312 ratings,0,0,0,0,5 out of 5
701,"Entertainment Earth Firefly Shiny Dice Game, Multi (82804)",Visit the Funko Store,9 ratings,0,1,8 answered questions,$10.99,4.8 out of 5
702,"Bestier Entertainment Center, Gaming TV Stand for 70 inch TV, LED TV Stand with Modern Glass Shelve, TV Media Console for Video Games, Movies, Home Decor, Rustic Brown",Brand: Overwatch,10 ratings,0,0,0,0,4.5 out of 5
703,Factory Entertainment Jaws Fandages Collectible Fashion Bandages,0,4 ratings,0,0,0,0,0
704,"Entertainment Earth Marvel Legends Thor, Rocket, and Groot Action Figures",Visit the Monopoly Store,213 ratings,0,1,12 answered questions,$36.41,
705,"LEGO Star Wars Imperial Probe Droid 75306 Collectible Building Toy, New 2021 (683 Pieces), Multicolor",Brand: MORK,2 ratings,0,0,0,$59.99,3.5 out of 5
706,"NFT BIBLE 2 in 1: Music & Gaming: The Complete Guide To Successfully Invest In, Create And Sell Non-Fungible Tokens In The Entertainment Industry (THE ... Creating, Buying and Selling Explained)",Brand: Playroom Entertainment,2 ratings,0,0,0,$9.99,5 out of 5
707,"Atlantic Mitsu 5-Tier Media Rack - holds 130 CD or 90 DVD/BluRay/Games, Smoke Finish, PN64835195",Brand: Factory Entertainment,106 ratings,0,0,0,$49.15,0
708,Factory Entertainment Monty Python and The Holy Grail Black Knight Tin Tote,Visit the Cryptozoic Entertainment Store,"3,347 ratings",0,0,0,$44.99,4.9 out of 5
709,Sunny Days Entertainment Navy Warfare Gunboat – Vehicle with 2 Army Men Action Figures and Realistic Accessories | Military Battleship Boat Toy for Kids – Elite Force,Visit the Off Topic Store,377 ratings,0,1,8 answered questions,0,4.5 out of 5
710,Hangrees The Roplops Collectible Parody Figure with Slime,Brand: Factory Entertainment,5 ratings,0,0,0,$15.99,0
711,"LEGO Star Wars Ultimate Millennium Falcon 75192 Expert Building Kit and Starship Model, Best Gift and Movie Collectible for Adults (7541 Pieces)",Brand: Factory Entertainment,370 ratings,0,0,0,0,4.3 out of 5
712,Throw Pillow Case The Office Merch Dwight Schrute Collage Cushion Home Living Room Soft Square Pillowcase Cover for Decor Bedroom Couch 18 X 18 Inch,Brand: POP,"1,390 ratings",0,0,6 answered questions,$37.99,4.8 out of 5
713,"Funny Makeup Bag-The Office Merchandise, The Office Gifts for Men, Women TV Show-Dwight, You Ignorant S…Wedding Gift Engagement Present Housewarming Gift",Brand: Factory Entertainment,28 ratings,0,0,0,0,5 out of 5
714,Entertainment Earth Designer Series Wonder Woman by Darwyn Cooke Action Figure,Visit the Cryptozoic Entertainment Store,198 ratings,0,0,0,0,4.4 out of 5
715,Throw Pillow Case Jesus Dwight Schrute Office Cushion Home Living Room Soft Square Pillowcase Cover for Decor Bedroom Couch 18 X 18 Inch,0,868 ratings,0,0,0,0,0
716,TERABITHIA 18inch 47cm Cute Soft Hand Rooted Curly Hair Silicone Vinyl Full Body Reborn Baby Dolls Look Real Preemie Collectible Newborn Doll Washable for Girl,Visit the LEGO Store,357 ratings,0,1,0,0,
717,LICRAFT Desk Sculpture Butterflies Desktop Stress Relief Toy Fidget Toy for Anxiety Office Gift Desk Intelligence Development,Brand: HW Cars,"90,202 ratings",0,0,0,$144.44,0
718,Baixin Metal Dice Set D&D， Hollow Hot Wheels Polyhedron DND Metal Dice Set， Dragon and Dungeon PRG Role Playing Game Dice (Blue),Visit the Nifeliz Store,"69,030 ratings",0,0,0,$69.95,5 out of 5
719,"LEGO Star Wars Ultimate Millennium Falcon 75192 Expert Building Kit and Starship Model, Best Gift and Movie Collectible for Adults (7541 Pieces)",Visit the Nifeliz Store,"39,874 ratings",0,0,0,$54.95,4.4 out of 5
720,Disney Animation Cel The Jungle Book Floating Down The River Rare Cell,Visit the EROCK Store,"96,586 ratings",0,0,0,$23.99,
721,Factory Entertainment Outlander Fraser Clan Metal Water Flask/Bottle,Visit the LA GRANJA DE ZENÓN Store,87 ratings,0,0,16 answered questions,$69.90,
722,Exclusive Mighty Morphin Power Rangers Red Ranger Ceramic Mug | Official Collectible Coffee Cup | Drinkware For Home Barware Set | Holds 11 Ounces,Brand: Alliance Entertainment,"6,477 ratings",0,0,0,$12.90,0
723,L.O.L. Surprise!: Where My Girls At?,Brand: Entertainment Earth,"52,917 ratings",0,0,7 answered questions,$36.55,4.5 out of 5
724,"HAOSHUNDA Horror Movies Oil Painting on Canvas Posters and Prints Decoracion Wall Art Picture Living Room Wall (12"" x 18"", Artwork - 05)",Brand: Factory Entertainment,132 ratings,0,0,0,0,4 out of 5
725,LOL Surprise Present Surprise™ Series 3 Birthday Month Theme with 8 Surprises (2 Sticker Sheets),Brand: Factory Entertainment,"65,941 ratings",0,0,4 answered questions,0,4.5 out of 5
726,"Mango Steam Wall-Mounted Steel Shelving Unit - 36 H X 24 W X 6 D Inches - Black - for Kitchen, Storage, or Display Use.",Brand: Factory Entertainment,18 ratings,0,0,0,$19.80,0
727,"Beast Kingdom Minions: Stealing Moon DS-050 D-Stage Statue, 6 inches",Brand: Surreal Entertainment,41 ratings,0,0,0,$15.99,4.8 out of 5
728,Exclusive Parks and Recreation Johnny Karate Ceramic Mug | Official TV Show Collectible Coffee Cup | Novelty Drinkware For Home Barware Set | Holds 11 Ounces,Brand: QISPIOD,1 rating,0,0,0,$26.99,
729,The Nutcracker,0,"4,253 ratings",0,0,0,0,4.6 out of 5
730,Exclusive Demon Slayer: Kimetsu no Yaiba Logo Ceramic Mug | Official Anime Collectible Coffee Cup | Novelty Drinkware For Home Barware Set | Holds 11 Ounces,Brand: Factory Entertainment,"14,025 ratings",0,0,0,$13.99,
731,"Funny Coffee Cup Ceramic Coffee Mug PaPa Mugs Dwight Schrute Coffee Mug Dad Mug Office Mug Man mug Father mug Worlds best boss mug( White,11ounces?",Visit the Great Eastern Entertainment Store,"74,507 ratings",0,0,0,$8.92,4.7 out of 5
732,"Esquirla Handcrafted International Chess Set Portable Wooden Chess Board Chess Game Chess Pieces for Kids Teens Collectible Travel Entertainment , M",Visit the Sunny Days Entertainment Store,7 ratings,0,0,32 answered questions,$31.60,
733,LEGO Architecture London Skyline Collection 21034 Building Set Model Kit and Gift for Kids and Adults (468 Pieces),0,374 ratings,0,0,0,$23.25,4.5 out of 5
734,David Prowse & Jeremy Bulloch Star Wars Authentic Signed 11x14 Insc. Photo BAS,Brand: PCS Collectibles,378 ratings,0,0,0,$39.99,0
