,Name,Brand,Rating,BestSeller,AmazonChoice,Comments,Price,Stars
735,"Exclusive The Office""Schrute Farms"" Ceramic Mug | Official TV Show Collectible, Dwight Schrute Coffee Cup | Drinkware For Home Barware Set | Holds 11 Ounces",Brand: Blizzard Entertainment,79 ratings,0,0,0,$65.55,0
736,"LEGO Ideas International Space Station 21321 Building Kit, Adult Set for Display, Makes a Great Birthday Present (864 Pieces)",Visit the Sunny Days Entertainment Store,"15,546 ratings",0,1,33 answered questions,$22.99,4.6 out of 5
737,The Blizzard 30th Anniversary Pin Portfolio Binder W/Exclusive Pin,0,"13,160 ratings",0,0,0,0,0
738,Prededence Tomb Raider - Starring LARA CROFT Collectible Card Game - Trading Cards (48 Packs/Box),Visit the 5 Surprise Store,"15,128 ratings",0,1,0,$11.99,
739,"Factory Entertainment James Bond NO TIME to DIE Safin Mask Limited Edition Prop Replica Fragmented Version, Large",Brand: POP,"65,944 ratings",0,0,0,0,4.9 out of 5
740,Factory Entertainment Ghostbusters Slimer Premium Motion Statue,Brand: Factory Entertainment,29 ratings,0,0,0,0,4 out of 5
741,"Entertainment Earth Marvel Legends Thor, Rocket, and Groot Action Figures",Brand: Factory Entertainment,"10,259 ratings",0,0,0,$39.95,4.6 out of 5
742,Marvel Collectible | Marvel Iron Man Armored Head 3D Ceramic Mug | 6 Ounces,Visit the Pick Your Poison Store,"164,802 ratings",0,0,20 answered questions,$24.95,4.5 out of 5
743,"Greenco Corner Shelf 5 Tier Shelves for Wall Storage, Easy-to-Assemble Floating Wall Mount Shelves for Bedrooms and Living Rooms, Espresso Finish",Visit the DC Collectibles Store,18 ratings,0,0,4 answered questions,0,4.5 out of 5
744,CelebriDucks The Wizard of Oz Glinda The Good Witch - Premium Bath Toy Collectible - Fantasy Themed,Brand: Factory Entertainment,787 ratings,0,0,0,$24.97,4.6 out of 5
745,"Nifeliz TH10 Steam Train Building Kit and Engineering Toy, Collectible Steam Locomotive Display Set, Train Set with Train Track, Top Present for Train Lovers (560 PCS)",0,1 rating,0,0,0,0,0
746,DC Collectibles Batman Black and White by Todd McFarlane Version 2 Deluxe Statue,Brand: Disney Pixar,"8,239 ratings",0,1,11 answered questions,$22.99,4.9 out of 5
747,"Upgraded House for Action Figures with Lighting System, 14.2 in x 11 in x 8.7 in Display Stand for Pop Figures and Toys, Dustproof Welloux",Visit the DC Collectibles Store,1 rating,0,0,0,$143.72,4.4 out of 5
748,"LEGO Art The Beatles 31198 Collectible Building Kit; an Inspiring Art Set for Adults That Encourages Creative Building and Makes a Great Gift for Music Lovers and Beatles Fans (2,933 Pieces)",Brand: MORK,"5,945 ratings",0,0,0,$51.99,0
749,Factory Entertainment Scarface Collectible Fashion Bandages,Visit the CelebriDucks Store,629 ratings,0,0,0,$19.99,
750,"COLLECTIBLE ADVERTISING Magazine Print Ad: 1992 MontBlanc Meisterstück LeGrand Solitaire Fountain pen, The Art of Writing",Visit the Bgraamiens Store,575 ratings,0,0,0,$12.99,
751,Donald Duck Devil Cosplay Wallet - Entertainment Earth Exclusive,Visit the TERABITHIA Store,60 ratings,0,0,8 answered questions,$123.69,4.2 out of 5
752,"Bugs Bunny in ""Baseball Bugs"" Studio Lobby Card Publicity Still - Warner Brothers",Visit the Bgraamiens Store,263 ratings,0,0,0,$12.99,
753,Iron Man (2020-) #23,Visit the Enesco Store,"3,014 ratings",0,0,0,$17.45,4.1 out of 5
754,DC Collectibles Justice League: Gods and Monsters: Superman Action Figure,0,45 ratings,0,0,0,0,0
755,Bates Motel Key Chain and Greetings Post Card,Brand: Marvel,"1,456 ratings",0,0,7 answered questions,$64.94,4.8 out of 5
756,"LEGO Marvel Iron Man: Iron Monger Mayhem 76190 Collectible Building Kit with Iron Man, Obadiah Stane and Pepper Potts; New 2021 (479 Pieces)",Visit the Factory Entertainment Store,929 ratings,0,0,0,$25.97,5 out of 5
757,"Factory Entertainment James Bond: Live and Let Die Tin Tote,Various",Visit the Cryptozoic Entertainment Store,"6,781 ratings",0,0,3 answered questions,0,4 out of 5
758,"Forever Collectibles Entertainment Mossy Oak Garden GnomeHunter with Binoculars - Winter Version, Team Colors, One Size",Brand: Factory Entertainment,22 ratings,0,0,0,0,
759,Marvel Classic Black Light Collectible Poster Portfolio Volume 2,0,52 ratings,0,0,0,0,4.6 out of 5
760,"Schleich bayala, Unicorn Toys, Unicorn Gifts for Girls and Boys 5-12 Years Old, Rainbow Unicorn Foal",Visit the HOMEOART Store,256 ratings,0,0,0,$38.99,4.7 out of 5
761,2019 Flair Marvel #82 U.S. Agent Official Entertainment Trading Card in Raw (NM or Better) Condition,Brand: Factory Entertainment,"1,255 ratings",0,0,0,$39.95,4.6 out of 5
762,2019 Cryptozoic Rick and Morty Season 2 Interdimensional Cable II #IDC11 How Did I Get Here Collectible Card from Adult Swim's Non Sport Entertainment Trading Card in Raw (NM or Better) Condition,Visit the ArtCreativity Store,168 ratings,0,0,0,$7.97,4.2 out of 5
763,2019 Cryptozoic Rick and Morty Season 2 Interdimensional Cable II #IDC10 Personal Space Collectible Card from Adult Swim's hit Non Sport Entertainment Trading Card in Raw (NM or Better) Condition,Brand: POP,465 ratings,0,0,0,$39.99,5 out of 5
764,2019 Cryptozoic Rick and Morty Season 2 Stickers #S14 Jerryboree Flyer/Blips and Chitz Sign Collectible Card from Adult Swim's Non Sport Entertainment Trading Card in Raw (NM or Better) Condition,Brand: POP,"11,879 ratings",0,0,0,$22.00,4.8 out of 5
765,2019 Cryptozoic Rick and Morty Season 2 Interdimensional Cable II #IDC3 Jan Quadrant Vincent 16 Collectible Card from Adult Swi Non Sport Entertainment Trading Card in Raw (NM or Better) Condition,Brand: POP,18 ratings,0,0,7 answered questions,$39.88,4.7 out of 5
766,"LEGO Star Wars: A New Hope Mos Eisley Cantina 75290 Building Kit; Awesome Construction Model for Display, New 2021 (3,187 Pieces)",0,"6,213 ratings",0,0,0,0,4 out of 5
767,Disney Animation Cel The Jungle Book Original Production Mowgli Vintage Cell,Visit the Skillmatics Store,32 ratings,0,1,14 answered questions,0,
768,World of Warcraft Chronicle Volume 3,Visit the Transformers Store,"4,212 ratings",0,0,0,$25.43,0
769,Factory Entertainment Men in Black Frank The Pug Shakems Collectible Figure,0,"78,479 ratings",0,0,0,0,0
770,"Star Wars The Mandalorian Galactic Snackin' Grogu Animatronic Toy with Over 40 Sound and Motion Combinations, Interactive Toys",0,"2,685 ratings",0,0,0,0,4.6 out of 5
771,How The Grinch Stole Christmas [VHS],Visit the Alter Nation Store,223 ratings,0,0,0,$19.99,4.6 out of 5
772,"Pocket Compendium: Tome of Recollection - Customizable RPG Item, Spellbook, & Reference Card Holder - Tabletop Fantasy Game Beginner Accessory - Includes 54 Custom Poker-Size Player Cards",Brand: coejokno,421 ratings,0,1,34 answered questions,$29.99,
773,Funko Pop! Marvel Eternals #730 Gilgamesh Vinyl Figure with Collectible Card Entertainment Earth Exclusive,Visit the Nintendo Store,629 ratings,0,1,0,0,
774,Animal Puzzle 1000 Pieces- Black and White Zebra - Puzzle for Adult Entertainment DIY Toys Collectibles Creative Birthday Gift for Kids Decompression Toy,Visit the LEGO Store,"89,899 ratings",0,0,3 answered questions,0,4.8 out of 5
775,"EDUCIRO Harry Castle Potter Building Kit with Clock Tower and Great Hall, Cool Collectible Toy for Age 14+ Adults, 866 Pieces",0,"15,546 ratings",0,0,0,0,4.7 out of 5
776,Schleich Farm World 11-Piece Roping Cowboy and Horse Toy Playset for Kids Ages 3-8,Visit the LEGO Store,129 ratings,0,1,19 answered questions,$248.49,4.9 out of 5
777,"Party Games Leather Dice Cup Set, 5 Leather Dice Cups + 25 Dice + Exclusive Storage and Transport Case Made of Faux Leather with Magnetic Closure",Visit the Factory Entertainment Store,"1,349 ratings",0,0,0,$25.95,5 out of 5
778,"The Office Balloons 50pcs The Office Party Decorations The Office Birthday Decorations The Office Latex Balloons for The Office Fans, Friend Theme Party Supplies",Visit the Nifeliz Store,"6,531 ratings",0,0,0,$54.95,4.6 out of 5
779,"Schleich bayala, Unicorn Toys, Unicorn Gifts for Girls and Boys 5-12 Years Old, Rainbow Unicorn Foal",Visit the Ingooood Store,"1,860 ratings",0,0,0,$20.99,4.4 out of 5
780,2019 Flair Marvel #82 U.S. Agent Official Entertainment Trading Card in Raw (NM or Better) Condition,Visit the Kismet Decals Store,"1,255 ratings",0,0,0,$14.93,
781,2019 Cryptozoic Rick and Morty Season 2 Interdimensional Cable II #IDC11 How Did I Get Here Collectible Card from Adult Swim's Non Sport Entertainment Trading Card in Raw (NM or Better) Condition,Visit the OFF THE SHOW Store,847 ratings,0,1,0,$19.95,4.8 out of 5
782,2019 Cryptozoic Rick and Morty Season 2 Interdimensional Cable II #IDC10 Personal Space Collectible Card from Adult Swim's hit Non Sport Entertainment Trading Card in Raw (NM or Better) Condition,Visit the Disney Cars Toys Store,115 ratings,0,0,0,$19.25,4.7 out of 5
783,2019 Cryptozoic Rick and Morty Season 2 Stickers #S14 Jerryboree Flyer/Blips and Chitz Sign Collectible Card from Adult Swim's Non Sport Entertainment Trading Card in Raw (NM or Better) Condition,0,758 ratings,0,0,0,0,5 out of 5
784,2019 Cryptozoic Rick and Morty Season 2 Interdimensional Cable II #IDC3 Jan Quadrant Vincent 16 Collectible Card from Adult Swi Non Sport Entertainment Trading Card in Raw (NM or Better) Condition,Visit the DIAMOND SELECT TOYS Store,"5,685 ratings",0,0,15 answered questions,$82.99,4.8 out of 5
785,"LEGO Star Wars: A New Hope Mos Eisley Cantina 75290 Building Kit; Awesome Construction Model for Display, New 2021 (3,187 Pieces)",Visit the The Trail of Painted Ponies Store,35 ratings,0,0,0,$45.00,4.8 out of 5
786,Disney Animation Cel The Jungle Book Original Production Mowgli Vintage Cell,Visit the Great Eastern Entertainment Store,"1,997 ratings",0,0,0,$18.50,5 out of 5
787,Factory Entertainment Men in Black Frank The Pug Shakems Collectible Figure,Visit the LEGO Store,"4,059 ratings",0,0,79 answered questions,$103.48,4.9 out of 5
788,"Trivial Pursuit Game: Stuff You Should Know Edition, Trivia Questions Inspired by the Stuff You Should Know Podcast, Game for Ages 16 and Up",Brand: Modiphius Entertainment,791 ratings,0,0,0,$12.99,How confident are you in finding a size that will fit you well?
789,Iron Man (2020-) #23,Brand: POP,"4,913 ratings",0,0,0,$22.99,4.8 out of 5
790,E-BEST CARE Cryptocurrency Dogecoin Coin Gold Plated Collectible Golden Doge Coin with Protective Case and Box(Doge Coin-Colorful),0,"4,261 ratings",0,0,0,0,0
791,Entertainment Earth Star Wars Luke Skywalker (X-Wing Pilot) Classic Mini Bust,Visit the Enesco Store,"13,177 ratings",0,0,0,$19.79,4.5 out of 5
792,"JianYia Super Hero Cake Decorations, Home Decoration. Titan Hero Sculpture Worth Collecting (24 Pieces)",Visit the POP Store,7 ratings,0,0,0,$16.70,4.8 out of 5
793,Pulp Fiction movie film cell bookmark Memorabilia Collectible Complements Poster Book Theater,Brand: Factory Entertainment,46 ratings,0,0,0,0,4.7 out of 5
794,Factory Entertainment Game of Thrones House Targaryen Dragon Sigil Throw Plush Pillow,Brand: Loungefly,258 ratings,0,0,0,$59.30,5 out of 5
795,"LEGO Star Wars Stormtrooper Helmet 75276 Building Kit, Cool Star Wars Collectible for Adults (647 Pieces)",Brand: Entertainment Earth,260 ratings,0,0,0,0,4.6 out of 5
796,Entertainment Earth DC Comics Superman Push Puppet,Visit the Bestier Store,629 ratings,0,0,0,$199.99,
797,Collectible OOAK Doll Sculpt game entertainment figurine of real person art work handmade gifts for girlfriend parents chrismas gift,Brand: Factory Entertainment,"89,905 ratings",0,0,0,$15.99,0
798,2021 Topps Heritage WWE #25 MACE Official World Wrestling Entertainment Trading Card in Raw (NM or Better) Condition,Brand: Entertainment Earth,"1,070 ratings",0,0,5 answered questions,$144.44,4.8 out of 5
799,World of Warcraft Chronicle Volume 3,Visit the LEGO Store,137 ratings,0,0,4 answered questions,$47.99,4.8 out of 5
800,2019 Cryptozoic Rick and Morty Season 2#29 Jerry's Mytholog Collectible Card from Adult Swim's hit TV Show Non Sport Entertainment Trading Card in Raw (NM or Better) Condition,0,332 ratings,0,0,0,0,5 out of 5
801,2019 Cryptozoic Rick and Morty Season 2 Silver Foil #3 Locked and Loaded Collectible Card from Adult Swim's hit TV Show Non Sport Entertainment Trading Card in Raw (NM or Better) Condition,Visit the Atlantic Store,"2,457 ratings",0,0,84 answered questions,$18.98,
802,2019 Cryptozoic Rick and Morty Season 2 Plumbus Deco Foil #33 Teen Angst Collectible Card from Adult Swim's hit TV Show Non Sport Entertainment Trading Card in Raw (NM or Better) Condition,Brand: Factory Entertainment,"2,025 ratings",0,0,0,$24.95,3.9 out of 5
803,"Display Case for Mini Action Figures with Lighting System for Collectible Pop Figures and Toys, Dustproof Showcase",Visit the Sunny Days Entertainment Store,418 ratings,0,0,23 answered questions,$31.20,4.7 out of 5
804,Hunting Jurassic World Dinosaur Bundled with Tracker Team Collection Hollywood Cars Off-Road Trucks Jeeps /Ford Explorer + Park Velociraptor Jungle Adventure Figure Hanger Dino Movie Keychain 2 Items,Brand: Hangrees,223 ratings,0,0,0,$15.41,
805,"CelebriDucks Give Geese A Chance Floating Rubber Ducks - Collectible Bath Toys Gift for Kids & Adults of All Ages - Fun, Safe, Sealed Baby Toddler Water Table, Pool, & Bathtub Toys - Made in USA",Visit the LEGO Store,571 ratings,0,0,114 answered questions,0,4.9 out of 5
806,Playmoji Pop Protector Case for 6 INCH Vinyl Figures (10 Pack),Brand: Zbenfm,"4,874 ratings",0,0,0,$12.98,
807,2019 Cryptozoic Rick and Morty Season 2#11 Beta-Seven Arrives Collectible Card from Adult Swim's hit TV Show Non Sport Entertainment Trading Card in Raw (NM or Better) Condition,Brand: Hanamiya Na,115 ratings,0,0,0,$10.98,4.6 out of 5
808,2019 Cryptozoic Rick and Morty Season 2 Plumbus Deco Foil #30 Tiny Rick Collectible Card from Adult Swim's hit TV Show Non Sport Entertainment Trading Card in Raw (NM or Better) Condition,Brand: Entertainment Earth,220 ratings,0,0,3 answered questions,$27.23,4.4 out of 5
809,2019 Cryptozoic Rick and Morty Season 2 Beth Knows Best #BKB03 Dicks Out Collectible Card from Adult Swim's hit TV Show Non Sport Entertainment Trading Card in Raw (NM or Better) Condition,Brand: Zbenfm,"1,288 ratings",0,0,0,$11.98,
810,2019 Cryptozoic Rick and Morty Season 2 Stickers #S3 Tinkles/Big Robot Collectible Card from Adult Swim's hit TV Show Non Sport Entertainment Trading Card in Raw (NM or Better) Condition,Visit the TERABITHIA Store,"1,552 ratings",0,0,0,$52.69,4.4 out of 5
811,2019 Cryptozoic Rick and Morty Season 2 Stickers #S1 Amish Cyborg/Mr. Poopybutthole Collectible Card from Adult Swim's hit TV S Non Sport Entertainment Trading Card in Raw (NM or Better) Condition,Brand: LICRAFT,"11,771 ratings",0,0,0,$16.99,4.1 out of 5
812,"Great Eastern Entertainment Naruto Shippuden SD Kakashi PVC Keychain,2""",Brand: Baixin,"15,171 ratings",0,0,0,$29.98,
813,2019 Cryptozoic Rick and Morty Season 2 Characters #C2 Birdperson Collectible Card from Adult Swim's hit TV Show Non Sport Entertainment Trading Card in Raw (NM or Better) Condition,Visit the LEGO Store,707 ratings,0,0,114 answered questions,0,4.9 out of 5
814,Flying V,0,630 ratings,0,0,0,"$4,636.00",0
815,2019 Cryptozoic Rick and Morty Season 2 Silver Foil #22 Bird Culture Ethics Collectible Card from Adult Swim's hit TV Show Non Sport Entertainment Trading Card in Raw (NM or Better) Condition,Brand: Factory Entertainment,"89,905 ratings",0,0,0,0,4.3 out of 5
816,2019 Cryptozoic Rick and Morty Season 2 Silver Foil #4 Rick to the Rescue Collectible Card from Adult Swim's hit TV Show Non Sport Entertainment Trading Card in Raw (NM or Better) Condition,Brand: Surreal Entertainment,366 ratings,0,0,0,$14.99,5 out of 5
817,2019 Cryptozoic Rick and Morty Season 2#3 Locked and Loaded Collectible Card from Adult Swim's hit TV Show Non Sport Entertainment Trading Card in Raw (NM or Better) Condition,0,"15,547 ratings",0,0,0,0,4.5 out of 5
818,2019 Cryptozoic Rick and Morty Season 2 Plumbus Deco Foil #5 Safe and Sound Collectible Card from Adult Swim's hit TV Show Non Sport Entertainment Trading Card in Raw (NM or Better) Condition,Visit the HAOSHUNDA Store,"5,999 ratings",0,1,9 answered questions,$24.99,
819,The Nutcracker,Visit the L.O.L. Surprise! Store,"1,513 ratings",1,0,19 answered questions,$4.98,4.7 out of 5
820,2019 Cryptozoic Rick and Morty Season 2#17 Parasite Extermination Collectible Card from Adult Swim's hit TV Show Non Sport Entertainment Trading Card in Raw (NM or Better) Condition,Visit the Mango Steam Store,246 ratings,0,0,0,$51.99,
821,2019 Cryptozoic Rick and Morty Season 2#13 Flying Under the Influence Collectible Card from Adult Swim's hit TV Show Non Sport Entertainment Trading Card in Raw (NM or Better) Condition,Visit the Beast Kingdom Store,275 ratings,0,0,0,$29.99,3.1 out of 5
822,2019 Cryptozoic Rick and Morty Season 2#5 Safe and Sound Collectible Card from Adult Swim's hit TV Show Non Sport Entertainment Trading Card in Raw (NM or Better) Condition,Brand: Surreal Entertainment,1 rating,0,0,0,$15.99,0
823,2019 Cryptozoic Rick and Morty Season 2#9 Jerryboree Collectible Card from Adult Swim's hit TV Show Non Sport Entertainment Trading Card in Raw (NM or Better) Condition,0,5 ratings,0,0,0,0,4.1 out of 5
824,2019 Cryptozoic Rick and Morty Season 2#14 Unity TV Collectible Card from Adult Swim's hit TV Show Non Sport Entertainment Trading Card in Raw (NM or Better) Condition,Brand: Surreal Entertainment,"3,951 ratings",0,0,0,$17.99,3.9 out of 5
825,2019 Cryptozoic Rick and Morty Season 2#26 Miniverse Collectible Card from Adult Swim's hit TV Show Non Sport Entertainment Trading Card in Raw (NM or Better) Condition,Brand: BZG,"7,514 ratings",0,0,0,$9.99,4.7 out of 5
826,L.O.L. Surprise!: Updated Collector's Guide,Brand: Esquirla,394 ratings,0,0,0,$51.99,
827,2019 Cryptozoic Rick and Morty Season 2#22 Bird Culture Ethics Collectible Card from Adult Swim's hit TV Show Non Sport Entertainment Trading Card in Raw (NM or Better) Condition,Visit the LEGO Store,16 ratings,0,1,0,$38.38,
828,DC Collectibles Justice League: Darkseid Deluxe Action Figure,Brand: PRESS PASS COLLECTIBLES,16 ratings,0,0,0,$399.99,0
829,Great Eastern Entertainment My Hero Academia Class 1-A Group Lunch Bag,Brand: Surreal Entertainment,5 ratings,0,0,0,$14.99,5 out of 5
830,"Hot Wheels id Vehicle The Dark Knight Batmobile with Embedded NFC Chip, Uniquely Identifiable, 1:64 Scale, for Kids Ages 8 Years and Older",Visit the LEGO Store,31 ratings,0,1,23 answered questions,$69.98,4.9 out of 5
831,"Kicko Assorted Dinosaurs in a Vehicle - 1 Set - Dino-Filled Car - for Party Favors, Entertainment, Collectible, Sensory, Prehistoric Themed, Fidget, Novelty, Therapeutic and Toys for Kids",0,630 ratings,0,0,0,0,3.6 out of 5
832,"DC Collectibles Artists Alley: Two-Face by James Groman Designer Vinyl Figure, Multicolor",Brand: Tomb Raider,"89,905 ratings",0,0,0,0,4 out of 5
833,"DC Collectibles Batman Black & White: Batman by Gene Colan Statue, Multicolor",Brand: Factory Entertainment,98 ratings,0,0,0,0,0
834,Cosmic Shades John Lennon Exclusive Rocks Figure Pop! Bundled with Retro The Yellow Submarine Beatles Die-Cast car Collectible Musical Memorabilia Psychedelic Wild Style Beatles Smiling Sub 2-Items,Brand: Factory Entertainment,"2,001 ratings",0,0,4 answered questions,0,4.3 out of 5
835,Lego Marvel Studios Series Loki Minifigure 71031,Brand: Entertainment Earth,70 ratings,0,0,5 answered questions,$144.44,4.8 out of 5
836,"Quiver Time Purple Bolt Collector Card Carrying Case ~ Card/Deck Storage Case with Wrist and Shoulder Strap, Dividers & Separators, Corner Pads + 100 Apollo Card Sleeves ~ Deck Box Bag Compatible",Brand: Iron Man,"3,014 ratings",0,0,0,$11.99,3.7 out of 5
837,"Mini SAI Green Sports Car MOC Building Blocks and Construction Toy, Adult Collectible Model Cars Set to Build, 1:14 Scale Sports Car Model (1168Pcs)",Visit the Greenco Store,"1,814 ratings",0,0,0,$31.00,
838,"Nostalgia Retro Vintage Car K500 MOC Building Blocks Car Set, Adult Collectible Model Cars Set to Build, 1:14 Scale Retro Car Model New (868 Pcs)",Visit the CelebriDucks Store,12 ratings,0,0,11 answered questions,$17.61,
839,CONAN BARBARIAN movie film cell bookmark Memorabilia Collectible Complements Poster Book Theater,Visit the Nifeliz Store,"1,544 ratings",0,0,3 answered questions,$39.95,0
840,DESTROY ALL MONSTERS GODZILLA Framed Trio 3 Film Cell Display Collectible Movie Memorabilia Complements Poster Book Theater,Visit the DC Collectibles Store,103 ratings,0,0,3 answered questions,$198.20,4.7 out of 5
841,Mickey Mouse Frankenstein Cosplay Wallet - Entertainment Earth Exclusive,Brand: WELLOUX,80 ratings,0,0,0,$43.99,0
842,2020 Upper Deck Marvel Annual Humble Beginnings Non-Sport TRADING CARD #HB-3 Captain America - Captain America Comics #1 Collectible TRADING CARD From The UD Company in Raw (NM or Better) Condition,Visit the LEGO Store,1 rating,0,1,26 answered questions,$213.58,4.8 out of 5
843,"Enter the Metaverse - The Beginners Guide to Virtual Worlds: NFT Games, Play-to-Earn, GameFi, and Blockchain Entertainment such as Axie Infinity, Decentraland, ... The Sandbox, Meta, Gala, Gods Unchained,",Brand: Factory Entertainment,24 ratings,0,0,0,$15.99,0
844,Great Eastern Entertainment Sailor Moon Playing Cards,0,5 ratings,0,0,0,$16.95,0
845,BACK TO THE FUTURE Movie Film Cell Bookmark Memorabilia Collectible Complements Poster Book Theater,Brand: Loungefly,75 ratings,0,0,0,$43.67,0
846,The Art of Apex Legends,0,209 ratings,0,0,0,$115.00,0
847,"Flying Ball Toys Mini Drone Flying Ball 360 Rotating Magic Controller USB Rechargeable Built-in RGB Lights Magic Flying Toys,Great Surprise and Safe Gift for Kids Outdoor Indoor [2022 Upgraded]",0,"1,006 ratings",0,0,0,0,0
848,Blizzcon 2016 Exclusive 10 Year Anniversary Beer Stein from Blizzard Entertainment,Brand: Entertainment Earth,244 ratings,0,0,0,0,4.3 out of 5
849,Cryptozoic Entertainment Teekeez: Red Son Superman & Wonder Woman Vinyl Figure 2 Pack,Brand: Bates Motel,5 ratings,0,0,0,$14.99,4.4 out of 5
850,Mini Video Game Console Game Player Entertainment System Classic 620 Built-in Games 2 Controllers by KeyroTeck,Visit the LEGO Store,23 ratings,0,1,0,$34.95,4.8 out of 5
851,"Funko 5 Star: Dc Comics - Harley Quinn Collectible Figure, Multicolor",Brand: Factory Entertainment,2 ratings,0,0,0,$20.35,5 out of 5
852,"Great Eastern Entertainment Kakuriyo- Akatsuki Sitting Plush 7"" H, Multicolor (77064)",Brand: Forever Collectibles,630 ratings,0,0,0,0,How confident are you in finding a size that will fit you well?
853,Marc Spector: Moon Knight #41 VF/NM ; Marvel comic book,0,925 ratings,0,0,0,0,0
854,Star Trek: The U.S.S. Enterprise NCC-1701 Illustrated Handbook Plus Collectible (Star Trek Illustrated Handbooks),Visit the Schleich Store,526 ratings,0,1,32 answered questions,$9.99,
855,Great Eastern Naruto Anti Leaf Village Headband,Brand: Upper Deck,57 ratings,0,0,0,$2.99,0
856,"Osmo - Coding Starter Kit for iPad Plus Pizza Co.- 3 Educational Learning Games - Ages 5-12+ - Learn to Code, Coding Basics, Coding Puzzles, Communication Skills & Math - STEM Toy (iPad Base Included)",Brand: Cryptozoic Entertainment,244 ratings,0,0,0,$4.49,0
857,"Hasbro Marvel Legends Series Studios The First Ten Years Iron Man 3 Movie Iron Man Mark Xxii, Pepper Potts, The Mandarin 6"" Figure 3 Pack (Amazon Exclusive)",Brand: Cryptozoic Entertainment,152 ratings,0,0,0,$2.99,0
858,"Mini SAI Red and White Saber Racing Car MOC Building Blocks and Construction Toy, Adult Collectible Model Cars Set to Build, 1:14 Scale Sports Car Model technic Set (1529 Pcs)",Brand: Cryptozoic Entertainment,1 rating,0,0,0,$3.99,0
859,Modiphius Entertainment Fallout: Wasteland Warfare - Two Player Starter Strategy Boxed Board Game Ages 12 & Up (Officially Licensed Fallout Miniatures Game),Brand: Cryptozoic Entertainment,28 ratings,0,0,0,$2.99,0
860,Monopoly Scooby-Doo! Board Game | Collectible Monopoly Game | Officially Licensed Scooby-Doo! Game | Featuring Character Artwork and Episodes,Visit the LEGO Store,302 ratings,0,0,22 answered questions,$349.95,4.8 out of 5
861,"Modular Castle System: Tabletop & RPG Terrain Game Set for Dungeons & Dragons, Pathfinder, Castles & Crusades, 13th Age, Runequest, Asunder, Zombicide, and More! - Baron Set (439+ Pieces 505 sqin)",0,27 ratings,0,0,0,"$4,636.00",0
862,4pcs Wolf Toy Figurines Set Arctic Wolf Animal Figures White Wolf Family Cake Topper Toy Gift for Kids (White),0,73 ratings,0,0,0,0,4.9 out of 5
863,"Star Wars The Black Series Ezra Bridger Toy 6-Inch-Scale Rebels Collectible Action Figure, Toys for Kids Ages 4 and Up",Brand: Factory Entertainment,103 ratings,0,0,0,0,5 out of 5
864,Toynk/Just Funky The Office Dundie Award Replica Trophy | Host Your Own The Office Dundies Awards Ceremony | Includes 6 Interchangeable Title Plates | Measures 8 Inches Tall,Visit the STAR WARS Store,93 ratings,0,0,20 answered questions,0,
865,Amazon.com Gift Card in Various Gift Boxes,0,"1,713 ratings",0,0,0,$19.99,4.8 out of 5
866,Amazon.com Gift Card in a Reveal (Various Designs),Visit the Stratagem Store,"6,943 ratings",0,0,15 answered questions,0,4.7 out of 5
867,Amazon.com Gift Card in a Birthday Pop-Up Box,Visit the Funko Store,"3,288 ratings",0,0,0,$10.00,5 out of 5
868,Amazon.com Gift Card in a Mini Envelope,Brand: QISPIOD,"10,454 ratings",0,0,0,$26.99,
869,Amazon.com $50 Gift Card - Pack of 10 Mini Envelopes,Visit the Under the Baubles Store,"33,673 ratings",0,0,7 answered questions,$37.99,
870,Amazon.com Gift Card in a Yellow Swirl Box,Visit the Schleich Store,"15,988 ratings",0,1,27 answered questions,$29.99,4.8 out of 5
871,Amazon.com Gift Card in a Birthday Gift Box (Various Designs),Brand: ImnBest,"10,648 ratings",0,0,0,$27.99,4.6 out of 5
872,"Amazon.com $50 Gift Cards, Pack of 10 (Holiday Globe Card Design)",Visit the Erweicet Store,"32,212 ratings",0,1,0,$10.77,4.6 out of 5
873,Amazon.com Gift Card in a Greeting Card (Various Designs),Visit the Schleich Store,"78,564 ratings",0,1,32 answered questions,$9.99,
