,Name,Brand,Rating,BestSeller,AmazonChoice,Comments,Price,Stars
301,"Clamper Single Surge Protector Outlet, Right Angle, Small& Space-Saving Power Strip- Protect Your Refrigerator, Phone, Appliances, Laptop and Other Electronics - Colour Clear, 2 Units",Visit the High Tech Pet Store,338 ratings,0,0,0,0,4.6 out of 5
302,Baseus Exquisite Rabbit Fan - Pink,Visit the Hercules Tuff Store,"25,292 ratings",0,0,163 answered questions,$44.99,4.5 out of 5
303,Rechargeable AAA Batteries 1000 Cycles NiMH Batteries AAA 1000 mAh Batteries 1.2V Pre-Charged Batteries Triple A Batteries for Electronic Equipment-8 Counts,Visit the ASURION Store,1 rating,0,0,48 answered questions,$10.99,4.5 out of 5
304,"SAMSUNG 32-inch Class LED Smart FHD TV 1080P (UN32N5300AFXZA, 2018 Model)",Visit the BAGSMART Store,24 ratings,0,0,0,$18.99,4.6 out of 5
305,"LUELLI Teeth Whitening Kit - 5X LED Light Tooth Whitener, 12ml with light",Brand: ORSEM,2 ratings,0,0,0,$15.99,0
306,"Kasa Smart Light Switch HS200, Single Pole, Needs Neutral Wire, 2.4GHz Wi-Fi Light Switch Works with Alexa and Google Home, UL Certified, No Hub Required , White",Visit the HAYEAR Store,15 ratings,0,0,0,$141.39,3.7 out of 5
307,Nakajima WPT-160 Electronic Portable Typewriter with Display and Memory,Brand: sunshare,35 ratings,0,0,0,$15.99,5 out of 5
308,ASURION 3 Year Electronics Protection Plan with Tech Support $200-249.99,Visit the EZQuest Store,35 ratings,0,0,0,$69.99,5 out of 5
309,"PUZZLEK Slim Carrying Case Compatible with Nintendo Switch Lite, Portable Protective Hard Shell Travel Case for Switch Lite Console & Accessories, 10 Game Cartridge - Black…",Visit the iFixit Store,35 ratings,0,1,0,$69.99,4.9 out of 5
310,Pertronix 1247 Ignitor Ford 4 Cylinder Electronic Ignition Conversion Kit,Visit the Tildaks Store,843 ratings,0,0,3 answered questions,$13.98,
311,"Marstone RC Piggy Toys for Kids, 2.4G Interactive Intelligent Electronic Pig Toy Remote Control Piggy with Sound & Light, Sprayer and Following Function, Toy Pigs Peg with Control for Girls and Boys",Visit the D'Addario Store,15 ratings,0,1,152 answered questions,$15.99,
312,120VAC Power Supply for Electronic Refrigerant Charging Scale,Brand: Honeywell,"12,868 ratings",0,1,65 answered questions,$613.84,4.3 out of 5
313,"Pomona Electronics 22495 2 ft (0.6 M) 50 Ohm Cable 0.195"" (5mm) O.D. RG58C/U",Visit the WIN.MAX Store,"6,290 ratings",0,0,55 answered questions,$165.99,
314,ASURION 3 Year Electronics Protection Plan with Tech Support $900-999.99,Visit the Windex Store,219 ratings,0,0,17 answered questions,0,
315,ASURION 3 Year Electronics Protection Plan with Tech Support $50-59.99,Visit the ASURION Store,"9,663 ratings",0,0,35 answered questions,$29.99,4.6 out of 5
316,"Tile Mate (2022) 2-Pack. Bluetooth Tracker, Keys Finder and Item Locator for Keys, Bags and More; Up to 250 ft. Range. Water-Resistant. Phone Finder. iOS and Android Compatible.",Visit the Arachnid Store,"16,235 ratings",0,0,13 answered questions,$165.45,4.4 out of 5
317,"Star Wars Kylo Ren Electronic Red Lightsaber Toy for Ages 6 and Up with Lights, Sounds, and Phrases Plus Access to Training Videos",Visit the Bonvoisin Store,1 rating,0,0,9 answered questions,$92.00,
318,"Cizilici Smart Door Lock, Keyless Entry Door Lock, Smart Lock for Front Door, Touchscreen Fingerprint Door Lock, Keypad Door Lock, Electronic Digital Door Lock, Passcode Door Lock",Brand: ZIKIVIX,60 ratings,0,0,0,$45.59,0
319,Electronics,Visit the ASURION Store,6 ratings,0,0,124 answered questions,$33.99,4.5 out of 5
320,Electronics,Brand: Atari,219 ratings,0,0,0,0,4.1 out of 5
321,Electronics,Visit the My Arcade Store,27 ratings,0,0,0,0,
322,Electronics,Visit the Fluke Store,43 ratings,0,0,8 answered questions,$722.00,
323,"AKAI Professional EWI Solo - Electronic Wind Instrument With Built-in Speaker, Rechargeable Battery, 200 Sounds and USB MIDI Connectivity",Visit the xasla Store,182 ratings,0,0,0,$69.99,4.6 out of 5
324,"Guitar Cable 10ft New bee Electric Instrument Cable Bass AMP Cord for Electric Guitar, Bass Guitar, Electric Mandolin, Pro Audio (Right Angle to Straight, Black)",Visit the Fluke Store,595 ratings,0,1,0,0,
325,Urth 100 x 100mm ND32 (5 Stop) Filter (Plus+),Visit the TALK WORKS Store,"9,663 ratings",0,1,0,0,4.6 out of 5
326,MH-65 Quick Charger for Nikon Battery: EN-EL12 Coolpix S31 S70 S80 S610 S610C S620 S630 S640 S710 S800c S1000 S1100 S1200 S3100 S6000 S6100 S6150 S6200 S6300 S8000 S8100 S8200 S9050 S9100 S9200 S9300,Visit the ASURION Store,13 ratings,0,0,23 answered questions,$57.99,4.6 out of 5
327,"Blue Light Blocking Computer Glasses,Magnetic Clip On Polarized Sunglasses,Eyeglasses Frames for Men Women Non Prescription(Leopard)",Visit the CGOLDENWALL Store,82 ratings,0,0,21 answered questions,$108.00,
328,"LCD Writing Tablet Board,Aoaizue 9 Inch Colorful Electronic Digital Writing Pad and Toddler Doodle Drawing Table with Lock Erase Button Educational and Learning Toy for Kids and Adults",Visit the ASEKER Store,6 ratings,0,0,0,$34.60,
329,Electronics,Visit the UBeesize Store,9 ratings,0,0,6 answered questions,$16.99,4.5 out of 5
330,Electronics,Brand: ertoory,106 ratings,0,0,0,$9.99,0
331,Electronics,Visit the Meta Portal Store,94 ratings,0,1,878 answered questions,$54.99,
332,Electronics,Visit the High Tech Pet Store,188 ratings,0,0,0,0,4.1 out of 5
333,"AKAI Professional EWI Solo - Electronic Wind Instrument With Built-in Speaker, Rechargeable Battery, 200 Sounds and USB MIDI Connectivity",Visit the Lutron Store,482 ratings,0,1,0,$59.95,
334,"Guitar Cable 10ft New bee Electric Instrument Cable Bass AMP Cord for Electric Guitar, Bass Guitar, Electric Mandolin, Pro Audio (Right Angle to Straight, Black)",0,"46,820 ratings",0,0,0,0,4.5 out of 5
335,"Native 1080P WiFi Bluetooth Projector, 8500L HD Video Mini Projector with Carrying Bag,Support 4K & 300"" Screen, Portable Outdoor Movie Projector for TV Stick, HDMI, AUX, PS4, Laptop, Phone",Visit the Roland Store,140 ratings,0,0,11 answered questions,0,4.7 out of 5
336,"BAGSMART Electronic Organizer,Travel Cable Bag,Double Layer Tech Bag,Electronics Accessories Carry Bag for 9.7 inch iPad, Kindle, Power Adapter",Brand: AnchorTec,11 ratings,0,0,0,$23.99,
337,ASURION 3 Year Electronics Protection Plan with Tech Support $40-49.99,Visit the Donner Store,"3,949 ratings",0,0,0,$289.99,0
338,"Ps4/Laptop screwdriver kit,Xbox one controller repair tool kit,Computer repair kit,magnetic screwdriver for iPhone,pc,Mac,Nintendo Switch,Eyeglass,tablet,Electronics etc",Visit the Arachnid Store,"2,660 ratings",0,0,0,$132.35,
339,"Active Electronic Strut Bypass Kit. Compatible With Buick, GMC, Cadillac, Chevrolet, Ford. 1997-2012",Brand: N\S,27 ratings,0,0,0,$26.66,
340,"HAYEAR Full Set 34MP 21MP 1080P 60FPS 2K HD HDMI USB C-Mount Electronic Industry Microscope Camera Digital Magnifier for PCB Repair + 180X C-Mount Lens+8"" HD LCD Monitor + 60 LED Illumination Light",Brand: LAIPENG,996 ratings,0,0,0,$32.80,5 out of 5
341,HAYEAR Full Set 34MP 21MP 2K 1080P 60FPS Full HD HDMI USB C-Mount Electronic Industry Microscope Camera Kit for PCB Repair Portable,Brand: Bidet,1 rating,0,0,0,$198.00,3.6 out of 5
342,Electronics Explained: The New Systems Approach to Learning Electronics,Visit the ASURION Store,359 ratings,0,0,35 answered questions,$29.99,4.6 out of 5
343,Electronics Explained: The New Systems Approach to Learning Electronics,Visit the ASURION Store,"145,482 ratings",0,0,9 answered questions,0,4.5 out of 5
344,Electronics Explained: The New Systems Approach to Learning Electronics,Visit the ASURION Store,7 ratings,0,0,101 answered questions,$33.99,4.5 out of 5
345,"Alesis Strike Amp 8 - 2000-Watt Drum Amplifier Speaker for Electronic Drum Sets With 8-Inch Woofer, Contour EQ and Ground Lift Switch",Visit the Gator Store,596 ratings,0,0,11 answered questions,$239.99,
346,Password Safe Electronic Storage Organizer Keeper Device and Stylus Bundle,Visit the Donner Store,"36,068 ratings",1,0,0,$239.99,0
347,"MiracleWipes for Electronics Cleaning - Screen Wipes Designed for TV, Phones, Monitors and More - Includes Microfiber Towel - (60 Count)",Brand: Avengers,"1,327 ratings",0,1,4 answered questions,$20.99,
348,"BAGSMART Electronic Organizer Small Travel Cable Organizer Bag for Hard Drives,Cables,USB, SD Card,Black",Visit the ASURION Store,115 ratings,0,0,5 answered questions,0,4.5 out of 5
349,"Projector with WiFi and Bluetooth, GROVIEW 9500L Native 1080P Projector, 300'' Full HD Movie Projector, Bluetooth projector, Supports 4K & Zoom, 5G Sync phone Screen, Compatible w/Laptop/PC/DVD/TV/PS5",Brand: Syncrobit,72 ratings,0,0,0,$399.00,3 out of 5
350,"Elixir Strings Electric Guitar Strings w NANOWEB Coating, Light (.010-.046)",Visit the ORIVISION Store,357 ratings,0,0,21 answered questions,$285.00,
351,"JBL Tune 225TWS True Wireless Earbud Headphones - JBL Pure Bass Sound, Bluetooth, 25H Battery, Dual Connect, Native Voice Assistant (Black)",Brand: Cadith,"6,923 ratings",0,0,3 answered questions,$8.88,4.5 out of 5
352,"USB 1080P HD Pro Webcam - with Auto Focus, Privacy Screen, and Dual Microphone, 360° Rotating Streaming Webcam for Computer, Skype, YouTube Video, Conference, Online Courses, Black",Brand: Symretie,12 ratings,0,0,0,$14.99,4.1 out of 5
353,"Vertical Docks for MS Surface | Dock Your Surface up Next to a Monitor with VESA (Surface Pro 7 / Pro 6 / Pro 2017 / Pro 4, Basic + | Without Electronics, Without VESA arm/Mount)",Visit the ASURION Store,1 rating,0,0,9 answered questions,0,4.5 out of 5
354,65w 45w Dell Laptop Charger New Replacement Charger(Compatible with All 65W 45W Round Tip),Visit the ASURION Store,763 ratings,0,0,3 answered questions,$160.99,4.5 out of 5
355,Xtreme Sight Line ~ Xecutive Faraday Bag for Phones and Other Small Electronics ~ Data Security for Executive Travel ~ Shoulder Strap Included ~ Tracking/Hacking Defense,Visit the ASURION Store,"27,858 ratings",0,0,67 answered questions,$10.99,4.5 out of 5
356,"Projector with WiFi and Bluetooth, GROVIEW 9500L Native 1080P Projector, 300'' Full HD Movie Projector, Bluetooth projector, Supports 4K & Zoom, 5G Sync phone Screen, Compatible w/Laptop/PC/DVD/TV/PS5",Visit the ASURION Store,"1,615 ratings",0,0,23 answered questions,0,4.5 out of 5
357,Electronics: A Systems Approach,Visit the Monstake Store,30 ratings,0,0,0,$12.99,
358,"Electronic Dartboard, Cabinet Doors, Stores 6 Soft Tip Darts, Integrated Scoreboard, 10 Darts & 100 Dart Tips, Many Game Types, for Adults & Children",Brand: BUKEBU,62 ratings,1,0,4 answered questions,$15.99,
359,"TNS-19252 NS-Switch Grip in-line Gamepad, Plug and Play, Suitable for N- Switch NS, can Charge and Play Games at The Same time, with six-axis Gyroscope Gravity Sensing, Dual-Motor Vibration",Brand: Avengers,503 ratings,0,1,4 answered questions,$20.99,
360,ASURION 4 Year Office Equipment Protection Plan with Tech Support $450-499.99,Visit the Alesis Store,951 ratings,0,0,82 answered questions,0,
361,"Elixir Strings Electric Guitar Strings w NANOWEB Coating, Light (.010-.046)",Brand: Narpult,"16,370 ratings",0,0,0,$139.99,
362,"Digital Camera for Kids Boys and Girls - 2.7K 48MP Children's Camera with 32GB SD Card, Rechargeable Electronic Mini Camera for Students, Teens, Kids£¨Blue£©",Brand: N/Y,3 ratings,0,0,0,$14.66,4.9 out of 5
363,Electronics: A Course Book for Students,Visit the Zink Store,"2,526 ratings",0,0,368 answered questions,$49.99,
364,Electronics: A Course Book for Students,Visit the Gator Store,"2,922 ratings",0,0,11 answered questions,$239.99,
365,"40 Counts 1.5V LR1/MN9100/E90/N Size Alkaline Batteries, Leak-Proof Batteries, High Performance and Powerful Batteries, Suitable for All Kinds of Electronic Equipment (40 Counts)",0,279 ratings,0,0,0,0,3.9 out of 5
366,"Professional Headphones TELLUR Voice 420, ENC - Environmental Noise Cancellation, Binaural, USB, 3.5mm Jack, Type C, In Line Remote Keys for Answer, Volume and Mute Microphone, Office & CallCenter, Bk",0,1 rating,0,0,0,0,3.9 out of 5
367,"AMESEDAK Compressed Air Duster, Cordless & Rechargeable Air Duster, 51000RPM Electric Air Blower for PC, Keyboard Electronics Cleaning, 6000mAh 10W Fast Charging",Visit the Fender Store,772 ratings,0,0,59 answered questions,0,
368,"Active Electronic Strut Bypass Kit. Compatible With Buick, GMC, Cadillac, Chevrolet, Ford. 2013-2018",Visit the Lacdo Store,"1,129 ratings",0,0,0,$12.99,
369,"1080P HD Projector, 5G WiFi Bluetooth 4K Projector, PENMAMA 9500L Movie Projector Support Zoom/Correct Keystone, Sync phone Screen, Compatible with HDMI, VGA, USB, SD Card, Phone, Laptop, PC, PS5, DVD",Visit the Acer Store,"2,055 ratings",0,0,156 answered questions,$369.99,
370,Ruggard Electronic Dry Cabinet (80L),Visit the Champion Range and Target Store,1 rating,0,0,58 answered questions,$269.99,4.8 out of 5
371,Electronic Dart Board - Dart Board 13.5 inch Dart Board Electronic Scoreboard for 16 Players - 6 Darts Plastic Tips for Electronic Dart Dartboard with LED Display Throw Line,Brand: Interstellar Electronics,"2,055 ratings",0,0,0,$199.90,4.8 out of 5
372,Flash Drive Case USB Memory Stick SD Card Storage Organizer- Holds 134pcs Thumb Drive Electronic Accessories Holder for Sandisk/Samsung/Inland/PNY/Netac,Brand: KUMPLE,297 ratings,0,0,0,$21.99,
373,"Howard Leight by Honeywell Impact Sport Sound Amplification Electronic Shooting Earmuff, Black",Brand: iQlQPQ,"1,588 ratings",0,0,13 answered questions,$49.99,
374,TC Electronic BAM200 Ultra-Compact 200 Watt Bass Head with Class-D Amp Technology,Visit the CYD Store,9 ratings,0,0,0,$19.89,4.4 out of 5
375,"MWXNE 3000 Watts Power Inverters, 12V DC to 110V AC Pure Sine Wave Car Power Adapter with LCD Display, Remote Control, 3 Outlets and Dual 4.2A USB Charging Ports",Visit the MOBILETRON Store,140 ratings,0,0,0,$109.99,0
376,DIY Electronic Enclosure Box Case 4U 175 x 279 x 305 mm. Full Aluminum Blue,Brand: Interstellar Electronics,128 ratings,0,0,0,$199.90,4.8 out of 5
377,Dymoece TT Mount Bike Handlebar Computer Mount for Garmin Edge Wahoo Elemnt,Visit the Pezin & Hulin Store,"1,746 ratings",0,0,7 answered questions,$49.99,
378,"Sony CEA-G80T 80GB CFexpress Type A Tough Memory Card Bundle with Sony LCSU21 Protective Camera Case - Black + Deco Gear Accessories Microfiber Electronics Cloth, Screen Protector Kit",Visit the ASURION Store,"1,003 ratings",0,0,95 answered questions,$33.99,4.5 out of 5
379,"BAGSMART Electronic Organizer Small Travel Cable Organizer Bag for Hard Drives, Cables, Phone, USB, SD Card, Black",Visit the HP Store,50 ratings,0,0,169 answered questions,0,
380,Presto 06850 16-inch Electric Skillet,Visit the SAMSUNG Store,146 ratings,0,1,1000+ answered questions,$227.99,
381,Electronics: A Systems Approach,Visit the MATEIN Store,21 ratings,0,0,67 answered questions,$35.99,
382,"FLANCCI LED Light Blocking Stickers, Light Dimming LED Filters, (2 Sheets) Dimming Sheets for Routers LED Covers Blackout, Dimming 50% ~ 80% of LED Lights",Visit the Kwikset Store,2 ratings,0,0,0,$119.98,
383,"xiji Soldering Pick Set, Soldering Aid Tool, Solder Tools Kit Cleaning Double-Headed for Electronics Soldering Circuit Board Electronic Components Electronics Repair",Visit the XOOL Store,42 ratings,0,1,15 answered questions,$28.89,
384,"Electric Air Duster for Keyboard Cleaning, Rechargeable 6000mAh Battery, Cordless, Powerful, Energy-Efficient, Replaces Compressed Gas Cans, Air Blower for Electronics, Computers",Visit the Pezin & Hulin Store,443 ratings,0,0,12 answered questions,$29.99,
385,Echo Auto- Hands-free Alexa in your car with your phone,Brand: Timstono,29 ratings,0,0,0,$179.99,
386,Electronics: A Course Book for Students,Visit the Endust Store,518 ratings,0,0,48 answered questions,0,4.3 out of 5
387,Electronics: A Course Book for Students,Visit the STAR WARS Store,136 ratings,0,0,3 answered questions,$39.60,4.5 out of 5
388,"GEEKPC 8.2'' Small Portable Monitor, 1280X800 IPS HDMI VGA Monitor 450 cd/m² Two Built-in Speakers Metal Shell Vesa for Industrial Computer Secondary Screen Game Screen Mining Rig Monitoring",Visit the Skycase Store,240 ratings,0,0,0,$13.99,
389,"Rockmoon 9200E Amplifier Police Siren & Metal Ultra Slime Octagon Compact Flat Speaker,DC12V 100W Multi-Tones Wired Control with Mic Loudspeaker Emergency Electronic PA System for Police Cars, Black",Visit the SteelSeries Store,23 ratings,0,1,452 answered questions,$249.99,
390,ASURION 2 Year Laptop Accident Protection Plan with Tech Support for Laptops $600 - $699.99,Visit the ASURION Store,1 rating,0,0,7 answered questions,$93.99,4.5 out of 5
391,ASURION 3 Year Electronics Protection Plan with Tech Support $30-39.99,Brand: IF,55 ratings,0,0,0,$28.75,
392,"Lutron Caseta Wireless Smart Lighting Dimmer Switch and Remote Kit for Wall & Ceiling Lights, P-PKG1W-WH, White",Visit the VAULTEK Store,2 ratings,0,0,170 answered questions,$119.99,
393,Amazon Basics Grade 3 Electronic Touchscreen Deadbolt Door Lock - Oil Rubbed Bronze,Visit the Kasa Smart Store,374 ratings,1,0,0,0,4.6 out of 5
394,Madden NFL 23 – PlayStation 5,Visit the M MOOCK Store,"13,630 ratings",0,0,0,$25.99,
395,Madden NFL 23 – PlayStation 4,Visit the C CLAMPER Store,14 ratings,0,0,0,$17.90,
396,"Square Off Grand Kingdom Set - World's Smartest Chess Board | Electronic, Automated & Magnetic Chess Set for Adults & Kids",Visit the Baseus Store,"1,605 ratings",0,0,0,$40.00,0
397,"Cable Organizer Bag, 2PCS Travel Cord Organizer Pouch Small Electronics Accessories Bag Tech Cord Storage Pouch for Cable, Charger, Phone, USB, SD Card,with 5pcs Cable Ties (Grey+Blue)",Brand: PILOCEL,"1,746 ratings",0,0,0,,4.7 out of 5
398,"Electronic Battleship Game, Multi Color",Visit the SAMSUNG Store,357 ratings,0,1,1000+ answered questions,$227.99,
399,"NI-MH AAA Rechargeable Battery 1.2V 630mah 4-Pack HHR-55AAABU AAA Battery for Panasonic Cordless Phones, Remote Controls, Electronics，AAA Battery Device.",Visit the LUELLI Store,5 ratings,0,0,73 answered questions,$16.99,4.5 out of 5
400,"Skycase Electronic Organizer,Large Cable Organizer Travel Bag ,All in one Electronics Accessories Cases for iPad Mini Series,Cables, Chargers, USB,Earphones,Portable Hard Drives, Power Banks,Grey",Visit the Kasa Smart Store,"10,028 ratings",1,0,0,0,4.6 out of 5
401,"Laptop Privacy Screen Protector Compatible with 15.6 Inch, Removable 16:9 Aspect Ratio Laptop Privacy Filter, Anti Spy/Easy Installation/Anti Glare/Blocking Blue Light",Brand: Nakajima,532 ratings,0,0,34 answered questions,0,3.8 out of 5
402,10.1inch LCD Writing Tablet with PU Protective Case Business Electronic Drawing Board with Cover Message Board Handwriting Pad Doodle Board for Office Adult Elder Children School (Black),Visit the ASURION Store,95 ratings,0,0,95 answered questions,$33.99,4.5 out of 5
403,Falcon Dust-Off Electronics Compressed Gas Duster 10 Oz (4 Pack),Brand: PUZZLEK,181 ratings,0,0,0,0,
404,"Tile Mate (2020) 1-pack - Bluetooth Tracker, Keys Finder and Item Locator for Keys, Bags and More; Water Resistant with 1 Year Replaceable Battery",Visit the Pertronix Store,359 ratings,0,0,40 answered questions,0,4.5 out of 5
405,"Electronic Organizer, BAGSMART Accessories Organizer Travel Double Layer Electronics Bag Large for 10.5 inch iPad Pro, Adapter, Cables, Black",Visit the Marstone Store,230 ratings,0,0,0,$10.99,4.2 out of 5
406,Victor M260 Multi-Kill Electronic Mouse Trap,Brand: Uniweld,24 ratings,0,0,0,$50.72,0
407,"BOJACK 37 Values 480 Pcs Electronics Component Fun Kit with Power Supply Module, Jumper Wire,Precision Potentiometer,830 tie-Points Breadboard Compatible with STM32,Raspberry Pi,Arduino",Visit the Pomona Electronics Store,205 ratings,0,0,0,$29.85,2 out of 5
408,Power Rangers Dino Fury Red Ranger Electronic Mask Roleplay Toy for Costume and Dress Up Inspired by The TV Show Ages 5 and Up,Visit the ASURION Store,10 ratings,0,0,7 answered questions,$93.99,4.5 out of 5
409,Fat Cat Electronx Electronic Dartboard Compact Size Over 35 Games with 167 Options Built-In Cabinet and Dart Storage for up to 12 Darts Auto Scoring LCD Display 8-Player Multiplayer and Soft Tip Darts,Visit the ASURION Store,7 ratings,0,0,77 answered questions,$6.99,4.5 out of 5
410,Falcon Dust-Off Electronics Compressed Gas Duster 10 oz (4 Pack) [New Improved Version],Visit the Tile Store,77 ratings,0,1,118 answered questions,0,
411,Headphones for Xbox PS4 PS5 PC and Cell-Phones,Visit the STAR WARS Store,27 ratings,0,0,3 answered questions,$39.60,4.5 out of 5
412,"Clamper Single Surge Protector Outlet, Right Angle, Small& Space-Saving Power Strip- Protect Your Refrigerator, Phone, Appliances, Laptop and Other Electronics - Colour Black, 2 Units",Brand: Cizilici,83 ratings,0,0,0,$159.00,
413,Electronics: A Top-Down Approach to Computer-Aided Circuit Design,0,13 ratings,0,0,0,0,4.2 out of 5
414,Fender Mini Deluxe Electric Guitar Amp,0,157 ratings,0,0,0,0,4.2 out of 5
415,"Screen & Electronic Cleaning Wipes | Pre-Moistened Individual Wrapped (6"" x 6"") TV Screen Cleaner, Computer Monitor, Laptop, Lens Wipes (200 Pack)",0,1 rating,0,0,0,0,4.2 out of 5
416,"Bamboo Charging Station Organizer for Multiple Devices (Included 5 Port USB Charger, 5 Pack Charge & Sync Cable, with Earbuds & Watch Stand), Electronic Device Desktop Stations for Cell Phone, Tablet",0,"2,641 ratings",0,0,0,0,4.2 out of 5
417,"My Arcade Go Gamer Classic-RED: Portable Electronic Game Console with 300 Games, Full Color 2.5"" Screen-Fun for The Whole Family (DGUN-3909)",Visit the Akai Professional Store,156 ratings,0,1,70 answered questions,$549.00,
418,"Matein Electronics Organizer, Waterproof Travel Electronic Accessories Case Portable Double Layer Cable Storage Bag for Cord, Charger, Power Bank, Flash Drive, Phone, Ipad Mini, SD Card, Tablet, Black",Visit the New bee Store,17 ratings,1,0,44 answered questions,$9.99,
419,Electronics Organizer Travel Case Cord Cable Organizer Bag Portable Waterproof Double Layers All-in-one Storage for Charger Mouse Earbud USB Drive Healthcare Grooming Kit,Visit the Urth Store,93 ratings,0,0,0,$107.00,
420,"Mini Projector, AuKing 2022 Upgraded 1080P Supported Outdoor Projector, Projector for Outdoor Use Compatible with HDMI, USB, Laptop, iOS and Android Phone",Brand: cjq,4 ratings,0,0,0,$33.99,0
421,"NI-MH AAA Rechargeable Battery 1.2V 630mah 6-Pack HHR-55AAABU AAA Battery for Panasonic Cordless Phones, Remote Controls, Electronics，AAA Battery Device.",Brand: Aisfev,3 ratings,0,0,6 answered questions,$14.00,
422,BJTR 94A CF294A Toner Cartridges Replacement for HP 94X CF294X Works for HP Laserjet Pro M148dw M148fdw M148 M118 M118dw M149fdw M149（2 Black ）,Brand: Aoaizue,7 ratings,0,0,0,$16.99,
423,FluxLight Brand HPE Compatible J8177C 1000Base-T Transceiver (10 Pack),0,5 ratings,0,0,0,0,4.2 out of 5
424,"MBSIX Tempered Glass Screen Protector Compatiple with 2022 Santa Fe 10.25 Inch Touch Screen,HD Clear,Scratch-Resistant,Anti Glare,Protecting Santa fe 10.25 Inch Screen",0,8 ratings,0,0,0,0,4.2 out of 5
425,"Mini Projector, AuKing 2022 Upgraded 1080P Supported Outdoor Projector, Projector for Outdoor Use Compatible with HDMI, USB, Laptop, iOS and Android Phone",0,"2,876 ratings",0,0,0,0,4.2 out of 5
426,"Electronic Throttle Body Compatible with Chrys-ler 200 Sebring Jeep Patriot Compass Dodge Caliber Avenge Journey 1.8L 2.0L 2.4L 2007-2017, Replacement for 04891735AC 4891735AD 977-025 with IAC & TPS",0,21 ratings,0,0,0,0,4.2 out of 5
427,"DDgro Electronic Travel Packing Organizer Pouch for Keeping Tech Accessories Cables Cords Charger Power Bank Mouse Earphones Pens (Medium, Dark Grey)",Visit the Akai Professional Store,62 ratings,0,1,70 answered questions,$549.00,
428,150W 4-Wire Electronic Load Tester 2.4 inch DC Tester APP Electronic Adjustment Constant Load Lithium Battery Capacity Monitor Discharge Charge Power Meter Supply Checker,Visit the New bee Store,2 ratings,1,0,44 answered questions,$9.99,
429,"Electronic Level, 24 in.L, Yellow",Visit the MOOKA FAMILY Store,3 ratings,0,0,10 answered questions,$169.99,3.9 out of 5
430,Kwikset CP913CNT-514S Kwikset 913CNT-S SmartCode Contemporary Single Cylinder Touchpad Electronic Deadbolt,Visit the BAGSMART Store,61 ratings,0,0,0,$19.99,
431,Walkers Razor Slim Electronic Shooting Hearing Protection Muff (Sound Amplification and Suppression) with Protective Case,Visit the ASURION Store,78 ratings,0,0,80 answered questions,$5.99,4.5 out of 5
432,Powstick Charging Station for Multiple Devices 60W 12A ETL Certified with Mixed Cables 6 USB Ports Fast Multi Charger Organizer for Cell Phones Tablets Smartphones Electronics for Home Office,Brand: LOFIXO,69 ratings,0,0,0,0,5 out of 5
433,AC Charger Fit for Ideapad S210 S500 S510p U430 ThinkPad L440 L540 T440 Essential G500 59373039 0B46994 0B47008 ADLX90NCC3A ADLX90NDC3A Power Supply Cord,Brand: M&P USA,15 ratings,1,0,12 answered questions,$44.95,3.6 out of 5
434,"LVYUAN Pure Sine Wave Inverter 2500 Watt Inverter 12V to 110V DC to AC with Remote Controller, LCD Display 4 AC Sockets and 4 USB Ports for Car Truck Solar Power",Visit the HAYEAR Store,362 ratings,0,0,3 answered questions,$322.18,2.8 out of 5
435,Steve Jobs,Visit the HAYEAR Store,15 ratings,0,0,7 answered questions,$190.89,4 out of 5
436,"Viper 850 Electronic Dartboard, Ultra Bright Triple Score Display, 50 Games With 470 Scoring Variations, Regulation Size Target-Tested-Tough Segments Made From High Grade Nylon, Includes 6 Darts",0,88 ratings,0,0,0,0,4.2 out of 5
437,Electronic Dictionary Bookmark (Translation Edition) - Spanish-English,0,"1,978 ratings",0,0,0,0,4.2 out of 5
438,"Electronic Drumsticks, Battery-Powered Air Drum Rock Beat Rhythm Stick Air Drumsticks with LED Lights and Multiple Built-in Instrument Sounds with Sensitive Tip + Speaker",0,15 ratings,0,0,0,0,4.2 out of 5
439,Marshall Amps Guitar Combo Amplifier (M-DSL5CR-U),Visit the Alesis Store,31 ratings,0,1,118 answered questions,$249.00,
440,"BAGSMART Electronic Organizer,Travel Cable Organizer",Brand: RecZone LLC,1 rating,0,0,0,$39.99,4.4 out of 5
